firstName	lastName	email	password	avatarURI	bio
Rhonda	Henninger	mailto:yolanda1982@yahoo.com	eaghi3iaF2u	https://www.fakepersongenerator.com/Face/female/female1021951517212.jpg	Subtly charming travelaholic. Tv scholar. Typical organizer. Friend of animals everywhere.
Letita	Ruby	mailto:garnett.schaef@yahoo.com	oGhai5ee	https://www.fakepersongenerator.com/Face/female/female1022378855316.jpg	Web guru. Avid bacon practitioner. Typical food fanatic. Friendly beer geek.
Larry	Arroyo	mailto:charlotte19@gmail.com	Viecaeph1m	https://www.fakepersongenerator.com/Face/male/male20121086099491791.jpg	Infuriatingly humble zombie nerd. Typical beer ninja. Devoted food geek. Bacon practitioner.
John	Villarreal	mailto:hunter1978@yahoo.com	uX1uughooth	https://www.fakepersongenerator.com/Face/male/male1084768476685.jpg	Devoted twitter practitioner. Prone to fits of apathy. Tv maven. Food guru. Incurable writer.
Sharon	Buckner	mailto:brenda1986@yahoo.com	ChohW7ei	https://www.fakepersongenerator.com/Face/female/female1021600490143.jpg	Devoted coffee fanatic. Lifelong writer. Foodaholic. Incurable beer geek. Hipster-friendly tv practitioner. Unapologetic web aficionado. Thinker.
Stevie	Henry	mailto:lucinda.botsfo@yahoo.com	ioPhee3she	https://www.fakepersongenerator.com/Face/male/male1085246829773.jpg	Typical entrepreneur. Lifelong beer expert. Hipster-friendly internet buff. Analyst. Social media enthusiast.
Santos	Rodriguez	mailto:te.hacket0@yahoo.com	doph0DahBei	https://www.fakepersongenerator.com/Face/female/female20151024223707092.jpg	Hipster-friendly internet evangelist. Proud communicator. Incurable thinker. Freelance creator. Total food enthusiast.
Eva	Bob	mailto:carley.sipe8@gmail.com	aepa4Hei6i	https://www.fakepersongenerator.com/Face/female/female20161024647404114.jpg	Social media maven. Typical pop culture practitioner. Travel fan. Wannabe internet enthusiast. Coffee specialist. Lifelong explorer.
Michael	Baugher	mailto:ollie2011@hotmail.com	ui6ir0beiY	https://www.fakepersongenerator.com/Face/male/male20161086287283478.jpg	Infuriatingly humble bacon practitioner. Extreme tv geek. General internet scholar. Zombie maven. Food fan. Professional web enthusiast. Problem solver.
Robbi	Davis	mailto:telly1996@yahoo.com	dah5cheeNg	https://www.fakepersongenerator.com/Face/female/female1022154549652.jpg	Proud zombie maven. Incurable web guru. Wannabe bacon enthusiast. Coffeeaholic. Alcohol fan.
Darryl	Dotson	mailto:iva2015@gmail.com	eeSaemu6xie	https://www.fakepersongenerator.com/Face/male/male20151083701139252.jpg	Professional coffee specialist. Hardcore student. Organizer. Proud pop cultureaholic. Entrepreneur. Gamer.
Bonnie	Sharpe	mailto:iva.jakubows@hotmail.com	ooJei2pai	https://www.fakepersongenerator.com/Face/female/female20111023456824279.jpg	Explorer. Evil internet buff. Lifelong social media maven. Troublemaker. Incurable organizer.
Iris	Haynes	mailto:filomena.barro@gmail.com	jaipahCh4	https://www.fakepersongenerator.com/Face/female/female1021976363434.jpg	General music practitioner. Zombie enthusiast. Wannabe gamer. Future teen idol. Travel maven. Explorer. Unapologetic tv advocate. Entrepreneur.
Larry	Froman	mailto:tatyana.doy@hotmail.com	phohGhu6Xee	https://www.fakepersongenerator.com/Face/male/male1085374622742.jpg	Extreme analyst. Travel advocate. Organizer. Professional music fanatic. Alcohol scholar. Incurable tv nerd.
Marjorie	Turner	mailto:noemy1971@hotmail.com	pha3ahXu	https://www.fakepersongenerator.com/Face/female/female20151024178480255.jpg	Freelance communicator. Thinker. Beer guru. Writer. Amateur pop culture trailblazer. Bacon aficionado. Passionate alcohol fanatic. Analyst.
Donna	Washington	mailto:hulda1980@hotmail.com	Ekelu8co9	https://www.fakepersongenerator.com/Face/female/female20151024337891601.jpg	